### ISSUE TITLE
[优化] 改用 http 长连接

### ISSUE THREAD

**Issue by youzi-2333** [Hex-Dragon/PCL2#3293]
### 检查项

- [X] 我已在 [Issues 页面](https://github.com/Hex-Dragon/PCL2/issues?q=is%3Aissue+) 和 [常见&难检反馈及问题列表](https://github.com/Hex-Dragon/PCL2/discussions/1930) 中搜索，确认了这一建议未被提交过。
- [X] 我已查看 [功能投票页面](https://github.com/Hex-Dragon/PCL2/discussions/categories/%E5%8A%9F%E8%83%BD%E6%8A%95%E7%A5%A8/)，确认了这一建议未在投票列表中。

### 描述

检索式：`is:issue 长连接` `is:issue keepalive` `is:issue keep alive` `is:issue http长连接`

昨天（2 月 8 日晚上 11:58），我正在研究 PCL 的请求头，设置了联网更新 `http://news.bugjump.net`，使用 Wireshark 抓包，意外发现 PCL 在请求了 `/version` 之后就四次挥手了，即没有使用 http 长连接。之后，又重新建立了连接，请求 `/`，即原始地址。

```
71	8.430563	192.168.100.107	43.129.69.122	TCP	66	4338 → 80 [SYN] Seq=0 Win=64240 Len=0 MSS=1460 WS=256 SACK_PERM=1
72	8.471355	43.129.69.122	192.168.100.107	TCP	66	80 → 4338 [SYN, ACK] Seq=0 Ack=1 Win=29200 Len=0 MSS=1424 SACK_PERM=1 WS=128
73	8.471490	192.168.100.107	43.129.69.122	TCP	54	4338 → 80 [ACK] Seq=1 Ack=1 Win=132352 Len=0
74	8.472116	192.168.100.107	43.129.69.122	HTTP	255	GET /version HTTP/1.1 
75	8.522182	43.129.69.122	192.168.100.107	TCP	60	80 → 4338 [ACK] Seq=1 Ack=202 Win=30336 Len=0
76	8.522182	43.129.69.122	192.168.100.107	HTTP	430	HTTP/1.1 301 Moved Permanently  (text/html)
77	8.522796	192.168.100.107	43.129.69.122	TCP	54	4338 → 80 [FIN, ACK] Seq=202 Ack=377 Win=131840 Len=0
78	8.523994	192.168.100.107	43.129.69.122	TCP	66	4340 → 443 [SYN] Seq=0 Win=64240 Len=0 MSS=1460 WS=256 SACK_PERM=1
79	8.563481	43.129.69.122	192.168.100.107	TCP	60	80 → 4338 [FIN, ACK] Seq=377 Ack=203 Win=30336 Len=0
80	8.563581	192.168.100.107	43.129.69.122	TCP	54	4338 → 80 [ACK] Seq=203 Ack=378 Win=131840 Len=0
81	8.566631	43.129.69.122	192.168.100.107	TCP	66	443 → 4340 [SYN, ACK] Seq=0 Ack=1 Win=29200 Len=0 MSS=1424 SACK_PERM=1 WS=128
82	8.566770	192.168.100.107	43.129.69.122	TCP	54	4340 → 443 [ACK] Seq=1 Ack=1 Win=132352 Len=0
83	8.567335	192.168.100.107	43.129.69.122	TLSv1.2	434	Client Hello
84	8.608329	43.129.69.122	192.168.100.107	TCP	60	443 → 4340 [ACK] Seq=1 Ack=381 Win=30336 Len=0
85	8.609612	43.129.69.122	192.168.100.107	TLSv1.2	163	Server Hello, Change Cipher Spec, Encrypted Handshake Message
```

除了第 78 条，71 到 80 是请求 `/version` 的三次握手到四次挥手的过程。而 78 81 82 及之后，是一个新的连接，我也不知道为啥 PCL 会给 `http://` 建立安全连接……如果这是另一个问题的话我会再交 issue。

因此，我希望能把 http 请求改为长连接，避免 TCP 连接资源的浪费。

### 原因

1. HTTP/1.1 默认开启了长连接（我看百度上是这样说的）。
2. 这样可以避免连接的浪费，能提升一点点的速度。
3. 这样可以方便服务端验证对方身份，例如对于每一个 TCP 连接，在 `/version` 请求过后 10 秒以内才能请求真正的主页内容。

个人认为如果想要做的话可以先扔投票，如果觉得没啥用就关掉好了……

**Comment by LTCatt** [comment]
有点没搞懂，到时候看看……

**Comment by Light-Beacon** [comment]
当用HTTP访问新闻主页时，服务器会发回一个301重定向强制使用https

**Comment by LTCatt** [comment]
所以这个实际上不是 bug……？

**Comment by Light-Beacon** [comment]
> 所以这个实际上不是 bug……？

主要他这个例子有问题，具体存在不存在这样的情况得另作测试

**Comment by JingHai-Lingyun** [comment]
抓个别的主页的包看看

**Comment by Light-Beacon** [comment]
可以使用 `http://test.bugjump.net/news/` 进行测试，这个我把重定向关掉了

**Comment by youzi-2333** [comment]
umm 其实我想反馈的是 PCL 在发送请求的时候 `Connection` 的值为 `Close`，这样的话会浪费连接资源（尤其是在同一个网站下载大量文件的时候）建议改为 `keep-alive` 使用 http 长连接……

对于服务器重定向到 https 的问题，我怀疑这是另一个 bug，不过现在没条件测试，等初五或者初六我再测一下……

**Comment by youzi-2333** [comment]
看来重定向到 https 是由于服务器返回了 301，不是 PCL 的问题。

不过 PCL 使用了两个 TCP 连接才完成了这个主页的加载（其实这才是我要反馈的……）并且服务器返回的也是 `Connection: keep-alive`，我希望能用一个连接就搞定

```
21	3.626480	192.168.100.107	43.129.69.122	TCP	66	13883 → 80 [SYN] Seq=0 Win=64240 Len=0 MSS=1460 WS=256 SACK_PERM=1
30	4.635168	192.168.100.107	43.129.69.122	TCP	66	[TCP Retransmission] [TCP Port numbers reused] 13883 → 80 [SYN] Seq=0 Win=64240 Len=0 MSS=1460 WS=256 SACK_PERM=1
31	4.694785	43.129.69.122	192.168.100.107	TCP	66	80 → 13883 [SYN, ACK] Seq=0 Ack=1 Win=29200 Len=0 MSS=1424 SACK_PERM=1 WS=128
32	4.694950	192.168.100.107	43.129.69.122	TCP	54	13883 → 80 [ACK] Seq=1 Ack=1 Win=132352 Len=0
33	4.696108	192.168.100.107	43.129.69.122	HTTP	260	GET /news/version HTTP/1.1 
34	4.758920	43.129.69.122	192.168.100.107	TCP	60	80 → 13883 [ACK] Seq=1 Ack=207 Win=30336 Len=0
35	4.759002	43.129.69.122	192.168.100.107	HTTP	217	HTTP/1.1 200 OK 
36	4.759603	192.168.100.107	43.129.69.122	TCP	54	13883 → 80 [FIN, ACK] Seq=207 Ack=164 Win=132096 Len=0
37	4.762424	192.168.100.107	43.129.69.122	TCP	66	13886 → 80 [SYN] Seq=0 Win=64240 Len=0 MSS=1460 WS=256 SACK_PERM=1
39	4.805362	43.129.69.122	192.168.100.107	TCP	66	80 → 13886 [SYN, ACK] Seq=0 Ack=1 Win=29200 Len=0 MSS=1424 SACK_PERM=1 WS=128
40	4.805489	192.168.100.107	43.129.69.122	TCP	54	13886 → 80 [ACK] Seq=1 Ack=1 Win=132352 Len=0
41	4.805608	43.129.69.122	192.168.100.107	TCP	60	80 → 13883 [FIN, ACK] Seq=164 Ack=208 Win=30336 Len=0
42	4.805672	192.168.100.107	43.129.69.122	TCP	54	13883 → 80 [ACK] Seq=208 Ack=165 Win=132096 Len=0
43	4.806215	192.168.100.107	43.129.69.122	HTTP	252	GET /news HTTP/1.1 
44	5.072066	192.168.100.107	43.129.69.122	TCP	252	[TCP Retransmission] 13886 → 80 [PSH, ACK] Seq=1 Ack=1 Win=132352 Len=198
45	5.123437	43.129.69.122	192.168.100.107	TCP	66	80 → 13886 [ACK] Seq=1 Ack=199 Win=30336 Len=0 SLE=1 SRE=199
50	5.928300	43.129.69.122	192.168.100.107	HTTP	1476	[TCP Previous segment not captured] Continuation
51	5.928300	43.129.69.122	192.168.100.107	HTTP	1476	Continuation
52	5.928300	43.129.69.122	192.168.100.107	HTTP	1476	Continuation
53	5.928300	43.129.69.122	192.168.100.107	TCP	1476	[TCP Out-Of-Order] 80 → 13886 [ACK] Seq=1 Ack=199 Win=30336 Len=1422
54	5.928300	43.129.69.122	192.168.100.107	HTTP	1476	Continuation
55	5.928300	43.129.69.122	192.168.100.107	HTTP	1114	Continuation
56	5.928300	43.129.69.122	192.168.100.107	HTTP	1476	Continuation
57	5.928300	43.129.69.122	192.168.100.107	HTTP	1476	Continuation
58	5.928300	43.129.69.122	192.168.100.107	HTTP	1476	Continuation
59	5.928300	43.129.69.122	192.168.100.107	HTTP	1476	Continuation
61	5.928423	192.168.100.107	43.129.69.122	TCP	66	[TCP Dup ACK 40#1] 13886 → 80 [ACK] Seq=199 Ack=1 Win=132352 Len=0 SLE=1423 SRE=5689
62	5.928516	192.168.100.107	43.129.69.122	TCP	54	13886 → 80 [ACK] Seq=199 Ack=5689 Win=132352 Len=0
63	5.928574	192.168.100.107	43.129.69.122	TCP	54	13886 → 80 [ACK] Seq=199 Ack=13859 Win=132352 Len=0
67	5.996214	43.129.69.122	192.168.100.107	HTTP	1476	Continuation
68	5.996214	43.129.69.122	192.168.100.107	HTTP	1476	Continuation
69	5.996214	43.129.69.122	192.168.100.107	TCP	1476	[TCP Spurious Retransmission] 80 → 13886 [ACK] Seq=1 Ack=199 Win=30336 Len=1422
70	5.996214	43.129.69.122	192.168.100.107	HTTP	1476	Continuation
71	5.996329	192.168.100.107	43.129.69.122	TCP	66	13886 → 80 [ACK] Seq=199 Ack=16703 Win=132352 Len=0 SLE=1 SRE=1423
72	5.996542	43.129.69.122	192.168.100.107	HTTP	1476	Continuation
73	5.996542	43.129.69.122	192.168.100.107	HTTP	1476	Continuation
74	5.996542	43.129.69.122	192.168.100.107	HTTP	1476	Continuation
75	5.996637	192.168.100.107	43.129.69.122	TCP	54	13886 → 80 [ACK] Seq=199 Ack=22391 Win=132352 Len=0
76	5.996743	43.129.69.122	192.168.100.107	HTTP	1476	Continuation
77	6.040542	192.168.100.107	43.129.69.122	TCP	54	13886 → 80 [ACK] Seq=199 Ack=23813 Win=130816 Len=0
78	6.055230	43.129.69.122	192.168.100.107	HTTP	1476	Continuation
79	6.055230	43.129.69.122	192.168.100.107	HTTP	1476	Continuation
80	6.055230	43.129.69.122	192.168.100.107	HTTP	1476	Continuation
81	6.055230	43.129.69.122	192.168.100.107	HTTP	1476	Continuation
82	6.055230	43.129.69.122	192.168.100.107	HTTP	1476	Continuation
83	6.055230	43.129.69.122	192.168.100.107	HTTP	1476	Continuation
84	6.055230	43.129.69.122	192.168.100.107	HTTP	1476	Continuation
85	6.055230	43.129.69.122	192.168.100.107	HTTP	1476	Continuation
86	6.055376	192.168.100.107	43.129.69.122	TCP	54	13886 → 80 [ACK] Seq=199 Ack=35189 Win=132352 Len=0
87	6.093736	43.129.69.122	192.168.100.107	HTTP	1476	Continuation
88	6.093736	43.129.69.122	192.168.100.107	HTTP	312	Continuation
89	6.093827	192.168.100.107	43.129.69.122	TCP	54	13886 → 80 [ACK] Seq=199 Ack=36869 Win=132352 Len=0
90	6.094205	192.168.100.107	43.129.69.122	TCP	54	13886 → 80 [FIN, ACK] Seq=199 Ack=36869 Win=132352 Len=0
91	6.135919	43.129.69.122	192.168.100.107	TCP	60	80 → 13886 [FIN, ACK] Seq=36869 Ack=200 Win=30336 Len=0
92	6.136002	192.168.100.107	43.129.69.122	TCP	54	13886 → 80 [ACK] Seq=200 Ack=36870 Win=132352 Len=0
```

```
(No. 35)
Hypertext Transfer Protocol
    HTTP/1.1 200 OK\r\n
    Server: nginx/1.18.0\r\n
    Date: Thu, 15 Feb 2024 07:57:20 GMT\r\n
    Content-Length: 41\r\n
    Connection: keep-alive\r\n
    \r\n
    [HTTP response 1/1]
    [Time since request: 0.062894000 seconds]
    [Request in frame: 33]
    [Request URI: http://test.bugjump.net/news/version]
    File Data: 41 bytes
    Data (41 bytes)
        Data: 313066616635636663333262396330363038383365326339656232653731353138663437…
        [Length: 41]
```

不仅仅是自定义主页，我在安装游戏的时候抓了个包，把 Forge 下载源 `maven.minecraftforge.net` 的 IP 筛了一遍，里面全都是 SYN，Fin 也一堆，Rst 也一堆，不知道建立了多少个连接，这个肯定是会拖慢下载速度的……

不知道是不是多线程下载导致的多个连接，但是毕竟我抓到的 PCL 的请求头都是 `Connection: close`（

**Comment by Light-Beacon** [comment]
感觉这好底层（应该是框架的事），这真的是PCL能改的吗（
